{
  "$schema": "https://json-schema.org/draft/2020-12/schema",
  "type": "object",
  "additionalProperties": false,
  "required": [
    "analysis_plan_sha256",
    "approval_sha256",
    "arrays",
    "definitive_execution_started",
    "human_gates",
    "production_eligible",
    "resource_classes",
    "resource_projection_sha256",
    "retry_policy",
    "schema_version",
    "scientific_data",
    "scientific_profile_sha256",
    "seed_derivation",
    "terminal_states"
  ],
  "properties": {
    "analysis_plan_sha256": {},
    "approval_sha256": {},
    "arrays": {},
    "definitive_execution_started": {},
    "human_gates": {},
    "production_eligible": {},
    "resource_classes": {},
    "resource_projection_sha256": {},
    "retry_policy": {},
    "schema_version": {},
    "scientific_data": {},
    "scientific_profile_sha256": {},
    "seed_derivation": {},
    "terminal_states": {}
  }
}
