{
  "analysis_plan_sha256": "4f12fef3b5a25ef271e2532da4e3208d447a5d3981a2a9884cf788ac1ae4d082",
  "approval_sha256": "acd34de34ee94f943ddfb2d088572196d74c5bde9eae8474e691b5f8ef89d336",
  "arrays": [
    {
      "array_id": "gate-approval",
      "concurrency_group": "cpu-independent/v1",
      "config_sha256": "c5f96f38bdbfb1b42419eda0b22ffce10748d14be91b2fc2673e16412e893b6d",
      "count": 1,
      "dependencies": [],
      "dimensions": {},
      "family": "human-gate",
      "operation_counts_per_member": {},
      "output_template": "stage15/protected_core/gate-approval/{index}.json",
      "priority": 10,
      "producer_interface": "stage12p3-contract/v1",
      "protected": true,
      "resource_class": "qualified-cpu/v1",
      "retention": "final-plus-latest-valid-recovery/v1",
      "retry_class": "stage13-fixed-logical-identity-max-three-attempts/v1",
      "scope": "protected_core",
      "shedding": "never",
      "tier": "tier1",
      "unavailable_consequence": "retain-terminal-state-no-imputation-no-replacement"
    },
    {
      "array_id": "stage14-qualification",
      "concurrency_group": "cpu-independent/v1",
      "config_sha256": "c5f96f38bdbfb1b42419eda0b22ffce10748d14be91b2fc2673e16412e893b6d",
      "count": 1,
      "dependencies": [
        "gate-approval"
      ],
      "dimensions": {},
      "family": "qualification-prerequisite",
      "operation_counts_per_member": {},
      "output_template": "stage15/protected_core/stage14-qualification/{index}.json",
      "priority": 10,
      "producer_interface": "stage12p3-contract/v1",
      "protected": true,
      "resource_class": "qualified-cpu/v1",
      "retention": "final-plus-latest-valid-recovery/v1",
      "retry_class": "stage13-fixed-logical-identity-max-three-attempts/v1",
      "scope": "protected_core",
      "shedding": "never",
      "tier": "tier1",
      "unavailable_consequence": "retain-terminal-state-no-imputation-no-replacement"
    },
    {
      "array_id": "gate-launch",
      "concurrency_group": "cpu-independent/v1",
      "config_sha256": "c5f96f38bdbfb1b42419eda0b22ffce10748d14be91b2fc2673e16412e893b6d",
      "count": 1,
      "dependencies": [
        "stage14-qualification"
      ],
      "dimensions": {},
      "family": "human-gate",
      "operation_counts_per_member": {},
      "output_template": "stage15/protected_core/gate-launch/{index}.json",
      "priority": 10,
      "producer_interface": "stage12p3-contract/v1",
      "protected": true,
      "resource_class": "qualified-cpu/v1",
      "retention": "final-plus-latest-valid-recovery/v1",
      "retry_class": "stage13-fixed-logical-identity-max-three-attempts/v1",
      "scope": "protected_core",
      "shedding": "never",
      "tier": "tier1",
      "unavailable_consequence": "retain-terminal-state-no-imputation-no-replacement"
    },
    {
      "array_id": "task1-teachers",
      "concurrency_group": "training/v1",
      "config_sha256": "c5f96f38bdbfb1b42419eda0b22ffce10748d14be91b2fc2673e16412e893b6d",
      "count": 15,
      "dependencies": [
        "gate-launch"
      ],
      "dimensions": {
        "seeds": [
          0,
          1,
          2,
          3,
          4,
          5,
          6,
          7,
          8,
          9,
          10,
          11,
          12,
          13,
          14
        ],
        "task": 1
      },
      "family": "teacher-training",
      "operation_counts_per_member": {
        "teacher_training": 1
      },
      "output_template": "stage15/protected_core/task1-teachers/{index}.json",
      "priority": 10,
      "producer_interface": "stage12p3-contract/v1",
      "protected": true,
      "resource_class": "qualified-accelerator-or-cpu/v1",
      "retention": "final-plus-latest-valid-recovery/v1",
      "retry_class": "stage13-fixed-logical-identity-max-three-attempts/v1",
      "scope": "protected_core",
      "shedding": "never",
      "tier": "tier1",
      "unavailable_consequence": "retain-terminal-state-no-imputation-no-replacement"
    },
    {
      "array_id": "task2-teachers",
      "concurrency_group": "training/v1",
      "config_sha256": "c5f96f38bdbfb1b42419eda0b22ffce10748d14be91b2fc2673e16412e893b6d",
      "count": 5,
      "dependencies": [
        "gate-launch"
      ],
      "dimensions": {
        "seeds": [
          0,
          1,
          2,
          3,
          4
        ],
        "task": 2
      },
      "family": "teacher-training",
      "operation_counts_per_member": {
        "teacher_training": 1
      },
      "output_template": "stage15/protected_core/task2-teachers/{index}.json",
      "priority": 10,
      "producer_interface": "stage12p3-contract/v1",
      "protected": true,
      "resource_class": "qualified-accelerator-or-cpu/v1",
      "retention": "final-plus-latest-valid-recovery/v1",
      "retry_class": "stage13-fixed-logical-identity-max-three-attempts/v1",
      "scope": "protected_core",
      "shedding": "never",
      "tier": "tier1",
      "unavailable_consequence": "retain-terminal-state-no-imputation-no-replacement"
    },
    {
      "array_id": "tractable-teacher",
      "concurrency_group": "training/v1",
      "config_sha256": "c5f96f38bdbfb1b42419eda0b22ffce10748d14be91b2fc2673e16412e893b6d",
      "count": 1,
      "dependencies": [
        "gate-launch"
      ],
      "dimensions": {
        "seeds": [
          0
        ],
        "task": "mod7-exact-calibration"
      },
      "family": "teacher-training",
      "operation_counts_per_member": {
        "teacher_training": 1
      },
      "output_template": "stage15/protected_core/tractable-teacher/{index}.json",
      "priority": 10,
      "producer_interface": "stage12p3-contract/v1",
      "protected": true,
      "resource_class": "qualified-accelerator-or-cpu/v1",
      "retention": "final-plus-latest-valid-recovery/v1",
      "retry_class": "stage13-fixed-logical-identity-max-three-attempts/v1",
      "scope": "protected_core",
      "shedding": "never",
      "tier": "tier1",
      "unavailable_consequence": "retain-terminal-state-no-imputation-no-replacement"
    },
    {
      "array_id": "task1-student-attempts",
      "concurrency_group": "training/v1",
      "config_sha256": "c5f96f38bdbfb1b42419eda0b22ffce10748d14be91b2fc2673e16412e893b6d",
      "count": 540,
      "dependencies": [
        "task1-teachers"
      ],
      "dimensions": {
        "conditions": 2,
        "phases": 3,
        "seeds": 15,
        "slots": 6,
        "task": 1
      },
      "family": "student-attempt",
      "operation_counts_per_member": {
        "student_attempts": 1
      },
      "output_template": "stage15/protected_core/task1-student-attempts/{index}.json",
      "priority": 10,
      "producer_interface": "stage12p3-contract/v1",
      "protected": true,
      "resource_class": "qualified-accelerator-or-cpu/v1",
      "retention": "final-plus-latest-valid-recovery/v1",
      "retry_class": "stage13-fixed-logical-identity-max-three-attempts/v1",
      "scope": "protected_core",
      "shedding": "never",
      "tier": "tier1",
      "unavailable_consequence": "retain-terminal-state-no-imputation-no-replacement"
    },
    {
      "array_id": "task2-student-attempts",
      "concurrency_group": "training/v1",
      "config_sha256": "c5f96f38bdbfb1b42419eda0b22ffce10748d14be91b2fc2673e16412e893b6d",
      "count": 80,
      "dependencies": [
        "task2-teachers"
      ],
      "dimensions": {
        "conditions": 2,
        "phases": 2,
        "seeds": 5,
        "slots": 4,
        "task": 2
      },
      "family": "student-attempt",
      "operation_counts_per_member": {
        "student_attempts": 1
      },
      "output_template": "stage15/protected_core/task2-student-attempts/{index}.json",
      "priority": 10,
      "producer_interface": "stage12p3-contract/v1",
      "protected": true,
      "resource_class": "qualified-accelerator-or-cpu/v1",
      "retention": "final-plus-latest-valid-recovery/v1",
      "retry_class": "stage13-fixed-logical-identity-max-three-attempts/v1",
      "scope": "protected_core",
      "shedding": "never",
      "tier": "tier2-protected",
      "unavailable_consequence": "retain-terminal-state-no-imputation-no-replacement"
    },
    {
      "array_id": "architecture-student-attempts",
      "concurrency_group": "training/v1",
      "config_sha256": "c5f96f38bdbfb1b42419eda0b22ffce10748d14be91b2fc2673e16412e893b6d",
      "count": 320,
      "dependencies": [
        "task1-teachers"
      ],
      "dimensions": {
        "architectures": 4,
        "conditions": 2,
        "phases": 2,
        "seeds": 5,
        "slots": 4
      },
      "family": "student-attempt",
      "operation_counts_per_member": {
        "student_attempts": 1
      },
      "output_template": "stage15/protected_core/architecture-student-attempts/{index}.json",
      "priority": 10,
      "producer_interface": "stage12p3-contract/v1",
      "protected": true,
      "resource_class": "qualified-accelerator-or-cpu/v1",
      "retention": "final-plus-latest-valid-recovery/v1",
      "retry_class": "stage13-fixed-logical-identity-max-three-attempts/v1",
      "scope": "protected_core",
      "shedding": "never",
      "tier": "tier2-protected",
      "unavailable_consequence": "retain-terminal-state-no-imputation-no-replacement"
    },
    {
      "array_id": "greedy-task1-direct",
      "concurrency_group": "discovery-greedy/v1",
      "config_sha256": "c5f96f38bdbfb1b42419eda0b22ffce10748d14be91b2fc2673e16412e893b6d",
      "count": 45,
      "dependencies": [
        "task1-teachers"
      ],
      "dimensions": {
        "models": "15 seeds x 3 phases"
      },
      "family": "greedy-discovery-ledger",
      "operation_counts_per_member": {
        "exact_evaluations": 256,
        "greedy_discovery_ledgers": 1
      },
      "output_template": "stage15/protected_core/greedy-task1-direct/{index}.json",
      "priority": 10,